{
    "$schema":  "https://raw.githubusercontent.com/earendil-works/envlinks/main/scripts/schemas/themepack-v1.schema.json",
    "name":  "tokyo-night-storm",
    "description":  "base16 scheme \u0027Tokyo Night Storm\u0027 (imported)",
    "nvim":  {
                 "engine":  "mini-base16"
             },
    "palette":  {
                    "base00":  "#24283b",
                    "base01":  "#16161e",
                    "base02":  "#343a52",
                    "base03":  "#444b6a",
                    "base04":  "#787c99",
                    "base05":  "#a9b1d6",
                    "base06":  "#cbccd1",
                    "base07":  "#d5d6db",
                    "base08":  "#c0caf5",
                    "base09":  "#a9b1d6",
                    "base0A":  "#0db9d7",
                    "base0B":  "#9ece6a",
                    "base0C":  "#b4f9f8",
                    "base0D":  "#2ac3de",
                    "base0E":  "#bb9af7",
                    "base0F":  "#f7768e"
                },
    "wt":  {
               "name":  "Tokyo Night Storm"
           },
    "author":  "Michaël Ball",
    "source":  "https://raw.githubusercontent.com/tinted-theming/schemes/spec-0.11/base16/tokyo-night-storm.yaml"
}
