{
    "$schema":  "https://raw.githubusercontent.com/earendil-works/envlinks/main/scripts/schemas/themepack-v1.schema.json",
    "name":  "gruvbox-dark",
    "description":  "base16 scheme \u0027Gruvbox dark\u0027 (imported)",
    "nvim":  {
                 "engine":  "mini-base16"
             },
    "palette":  {
                    "base00":  "#282828",
                    "base01":  "#3c3836",
                    "base02":  "#504945",
                    "base03":  "#665c54",
                    "base04":  "#928374",
                    "base05":  "#ebdbb2",
                    "base06":  "#fbf1c7",
                    "base07":  "#f9f5d7",
                    "base08":  "#cc241d",
                    "base09":  "#d65d0e",
                    "base0A":  "#d79921",
                    "base0B":  "#98971a",
                    "base0C":  "#689d6a",
                    "base0D":  "#458588",
                    "base0E":  "#b16286",
                    "base0F":  "#9d0006"
                },
    "wt":  {
               "name":  "Gruvbox dark"
           },
    "author":  "Tinted Theming (https://github.com/tinted-theming), morhetz (https://github.com/morhetz/gruvbox)",
    "source":  "https://raw.githubusercontent.com/tinted-theming/schemes/spec-0.11/base16/gruvbox-dark.yaml"
}
