{
    "$schema":  "https://raw.githubusercontent.com/earendil-works/envlinks/main/scripts/schemas/themepack-v1.schema.json",
    "name":  "gruvbox-dark-hard",
    "description":  "base16 scheme \u0027Gruvbox dark, hard\u0027 (imported)",
    "nvim":  {
                 "engine":  "mini-base16"
             },
    "palette":  {
                    "base00":  "#1d2021",
                    "base01":  "#3c3836",
                    "base02":  "#504945",
                    "base03":  "#665c54",
                    "base04":  "#bdae93",
                    "base05":  "#d5c4a1",
                    "base06":  "#ebdbb2",
                    "base07":  "#fbf1c7",
                    "base08":  "#fb4934",
                    "base09":  "#fe8019",
                    "base0A":  "#fabd2f",
                    "base0B":  "#b8bb26",
                    "base0C":  "#8ec07c",
                    "base0D":  "#83a598",
                    "base0E":  "#d3869b",
                    "base0F":  "#d65d0e"
                },
    "wt":  {
               "name":  "Gruvbox dark, hard"
           },
    "author":  "Dawid Kurek (dawikur@gmail.com), morhetz (https://github.com/morhetz/gruvbox)",
    "source":  "https://raw.githubusercontent.com/tinted-theming/schemes/spec-0.11/base16/gruvbox-dark-hard.yaml"
}
